id,link,title,content,db1_overall,l.berrangford_db1,apfisch_db1,ee18ivc_db1,miriam_db1,db2_overall,l.berrangford_db2,apfisch_db2,ee18ivc_db2,miriam_db2,l.berrangford_notes,apfisch_notes,ee18ivc_notes,miriam_notes
1547893,https://apsis.mcc-berlin.net/scoping/document/193/1547893/,"Flood management in cities of developing countries: the example of Ibadan, Nigeria","Flooding, a common environmental hazard worldwide has, in recent times, increased as a result of climate change, with the effect felt more by the poor in developing countries. In Nigeria, as in most developing countries, flooding has been linked to natural causes, urbanisation and poor management practices. It has resulted to loss of lives, income, property damage and spread of diseases. The recurrent incidences of flooding and associated risks in cities of developing countries have necessitated a review of the approaches to flood risk management in Nigeria. This paper takes a look at the incidence of flooding in Ibadan, a major city in Nigeria. It examines its causes, effects and the effectiveness of the flood management options. The study found that even with daunting challenges of financial constraints, mismanagement, lack of continuity in governance and policy, and small-scale flood management remedies, such as proper waste management, dredging, clearing of channels and bridge throughway, have proven effective in the management of flood risks. The study recommends an intensification of non-structural strategies of flood management.",Mixed,Yes,Yes,Maybe,Maybe,Mixed/Maybe,Yes,Yes,Unrated,Unrated,,,,not sure if empirical 
1557062,https://apsis.mcc-berlin.net/scoping/document/193/1557062/,"A multitaxic bonebed near the Carboniferous-Permian boundary (Halgaito Formation, Cutler Group) in Valley of the Gods, Utah, USA: Vertebrate paleontology and taphonomy","The Carboniferous Permian (C-P) transition records a shift in the composition and environmental setting of tropical flora and vertebrate assemblages across western and central Pangea. Here we report the discovery of a rare, multitaxic bonebed in the lower Halgaito Formation (Cutler Group) in Valley of the Gods and its vicinity (San Juan County), southeast Utah, USA. The assemblage, which comprises carcasses and disarticulated bones and teeth, preserves aquatic and semi-terrestrial elements including xenacanth chondrichthyans, actinopterygians, sagenodontid lungfish, and the temnospondyl amphibian Eryops, together with terrestrial taxa including the synapsids, Ophiacodon navajovicus, Edaphosaunrus, and Sphenacodon, and a hitherto undescribed araeoscelidan reptile. Sedimentological, paleontological, and strontium isotopic evidence indicates the bonebed formed as a slackwater deposit at the confluence of a major freshwater stream channel and its tributary. The deposit probably formed through late stage flooding of a likely bottlenecked fluvial system, consistent with increasingly episodic or seasonal precipitation, concentrating carcasses of immature and mature shore-dwelling animals. Comparisons with vertebrate assemblages in the Cutler Group of New Mexico, USA suggest that the assemblage is correlative with the lower or middle assemblage of the El Cobre Canyon Formation (Cobrean and Coyotean Land Vertebrate Faunachrons; LVFs), and as such, is of latest Carboniferous age. Our findings strengthen the hypothesis that dryland-adapted vertebrate communities proliferated earlier in westernmost Pangea, well before earliest Permian time, compared to other tropical regions.",No,No,No,No,No,Unrated,Unrated,Unrated,Unrated,Unrated,Irrelevant                    ,,,
1629075,https://apsis.mcc-berlin.net/scoping/document/193/1629075/,"Climate will increasingly determine post-fire tree regeneration success in low-elevation forests, Northern Rockies, USA","Climate change is expected to cause widespread shifts in the distribution and abundance of plant species through direct impacts on mortality, regeneration, and survival. At landscape scales, climate impacts will be strongly mediated by disturbances, such as wildfire, which catalyze shifts in species distributions through widespread mortality and by shaping the post-disturbance environment. We examined the potential for regional shifts in low-elevation tree species in response to wildfire and climate warming in low-elevation, dry mixed-conifer forests of the northern Rocky Mountains, USA. We analyzed interactions among climate and wildfire on post-fire tree seedling regeneration 5-13 yr post-fire at 177 sites burned in 21 large wildfires during two years with widespread regional burning. We used generalized additive mixed models to quantify how the density of Douglas-fir and ponderosa pine seedlings varied as a function of climate normals (30-yr mean temperature, precipitation, soil moisture, and evapotranspiration) and fire (tree survivorship, burn severity, and seed source availability). Mean summer temperature was the most important predictor of post-fire seedling densities for both ponderosa pine and Douglas-fir. Seed availability was also important in determining Douglas-fir regeneration. As mean summer temperature continues to increase, however, seed availability will become less important for determining post-fire regeneration. Above a mean summer temperature of 17 degrees C, Douglas-fir regeneration is predicted to be minimal regardless of how close a seed source is to a site. The majority (82%) of our sampled sites are predicted to exceed a mean summer temperature of 17 degrees C by mid-century, suggesting significant declines in seedling densities and potential forest loss. Our results highlight mechanisms linking climate change to shifts in the distribution of two widely dominant tree species in western North America. Under a warming climate, we expect post-fire tree regeneration in these low-elevation forests to become increasingly unsuccessful. Such widespread regeneration failures would have important implications for ecosystem processes and forest resilience, particularly as wildfires increase in response to climate warming.",No,No,No,No,No,Unrated,Unrated,Unrated,Unrated,Unrated,No human component.                    ,,,
1639539,https://apsis.mcc-berlin.net/scoping/document/193/1639539/,Powering the Future with Liquid Sunshine,"In 2017, global CO2 emissions from burning fossil fuels reached 33 gigatons, twice the natural rate at which CO2 is absorbed back into land and ocean sinks. Harnessing solar radiation holds the answer to reducing our dependence on fossil fuels. It is the most abundant energy resource and could meet humans’ future energy needs. The efficient conversion of solar radiation into stable, energy-dense liquid energy carriers that can use existing or adapt global supply chains for storage, shipping, and distribution is the key to large-scale deployment of solar energy at gigaton levels. Liquid sunshine is the vision of combining the sun's energy with carbon dioxide and water to produce green liquid fuels. CO2 released on using these fuels is recycled back into the environment, thus maintaining an ecologically balanced cycle. Multi-source and multi-purpose alcohols are optimal candidate fuels. Methanol and ethanol are actionable first targets with gigaton production potential. The intertwined goals of economic growth, environmental conservation, and energy security (3E) are pressing global challenges of our time. The paper discusses solutions to 3E goals, particularly in the context of developing countries that are most affected by climate change and local environmental degradation. 3E goals call for “common man solutions”; cheap, clean energy that can help combat hazardous pollution threatening public health and break the mutually reinforcing downward spiral of human poverty and environmental degradation. Alcohols are clean, affordable, multi-source, multi-purpose fuels that can rise to the call. The liquid sunshine roadmap charts stepwise technology advancements from intermediate technologies such as natural gas renewable hybrid systems to green systems for methanol production entirely from renewable energy. Intermediate solutions such as hybrid alcohols build production capacity, establish downstream markets, and begin the adaptation of existing supply chain infrastructure for subsequent widespread market penetration of alcohols in the global energy market. Hybrid alcohols also provide the “breathing space” until green technologies reach maturity for commercial production of green alcohols. Looking ahead, green alcohols and electricity can function as the dual pillars of green energy systems, with alcohol reservoirs forming the backbone. Such green energy systems can support myriad applications and services to build a sustainable future. Replacing fossil fuels with renewables will require efficient carriers of the sun's energy at gigaton scale. The diagram illustrates an ecologically balanced cycle where green alcohols are produced by combining sunshine with CO2 and H2O drawn from the environment and returned to the environment. Only the sun's energy is consumed in the cycle. Methanol, an example of a green alcohol, is a multi-purpose liquid energy carrier of the Sun's energy. It can also function as “liquid hydrogen” and “liquid electricity.” © 2018 Elsevier Inc.",No,No,No,No,No,Unrated,Unrated,Unrated,Unrated,Unrated,Mitigation focused.                    ,,,
1717743,https://apsis.mcc-berlin.net/scoping/document/193/1717743/,Role of community based local institution for climate change adaptation in the Teesta riverine area of Bangladesh,"Climate change adaptation is one of the most crucial issues in developing countries like Bangladesh. The main objective was to understand the linkage of participation with Community Based Adaptation (CBA) to climate change. Institutional framework following different types of conceptual theories (collective action, group, game and social learning theory) was utilized to analyze the participatory process in local community level Village Disaster Mangement Committee (VDMC) that works in collaboration with local government. Field level data was collected through interview and group discussion during 25 April to 30 May 2015 in the Teesta riverine area of northern Bangladesh. Results showed that flood and drought were the major climate change impacts in the study area, and various participatory tools were used for risk assessment and undertaking action plans to overcome the climate change challenges by the group VDMC. Participation in VDMC generated both relational and technical outcomes. The relational outcomes are the informal institutional changes through which local community adopt technological adaptation measures. Although, limitations like bargaining problem, free riding or conflict were found in collective decision making, but the initiation of local governance like VDMC has brought various institutional change in the communities in terms of adaptation practices. More than 80% VDMC and around 40-55% non-VDMC household respondents agreed that overall community based adaptation process was successful in the previous year. They believed that some innovative practices had been brought in the community through VDMC action for climate change adaptation. No doubt that the CBA has achieved good progress to achieve the government Comprehensive Disaster Management (CDM) strategy of climate change adaptation. But, there is still lack of coordination among local government, NGOs and civil partners in working together. Research related to socio-economic impact analysis for the sustainability of adaptation measures implemented through local community could be undertaken in future. (C) 2017 The Authors. Published by Elsevier B.V. This is an open access article under the CC BY-NC-ND license (http://creativecommons.org/licenses/by-nc-nd/4.0/).",Mixed,Yes,Yes,Maybe,Yes,Mixed/Maybe,No,Maybe,Unrated,No,"Adaptation decision-making processes, but no empirical documentation of risk-reducing responses.                    ","some reference to actions taken:
""various participatory tools were used for risk assessment and undertaking action plans
""the relational outcomes are the informal institutional changes through which local community adopt technological adaptation measures
""some innovative practices had been brought in the community through VDMC action for climate change adaptation""",,
1782427,https://apsis.mcc-berlin.net/scoping/document/193/1782427/,Strategic Development Challenges in Marine Tourism in Nunavut,"Marine tourism in Arctic Canada has grown substantially since 2005. Though there are social, economic and cultural opportunities associated with industry growth, climate change and a range of environmental risks and other problems present significant management challenges. This paper describes the growth in cruise tourism and pleasure craft travel in Canada's Nunavut Territory and then outlines issues and concerns related to existing management of both cruise and pleasure craft tourism. Strengths and areas for improvement are identified and recommendations for enhancing the cruise and pleasure craft governance regimes through strategic management are provided. Key strategic approaches discussed are: (1) streamlining the regulatory framework; (2) improving marine tourism data collection and analysis for decision-making; and (3) developing site guidelines and behaviour guidelines.",No,No,No,No,No,Unrated,Unrated,Unrated,Unrated,Unrated,Not sufficiently focused on climate change.                    ,,,
1821640,https://apsis.mcc-berlin.net/scoping/document/193/1821640/,Echinoderm ecotoxicology: Application for assessing and monitoring vulnerabilities in a changing ocean,"Ocean acidification is a major threat to the Echinodermata because it decreases availability of the carbonate ions required for skeletogenesis. Ocean pH will change simultaneously with ocean warming and hypercapnia and all these stressors are likely to impact vulnerable early life history stages. To address questions on future vulnerabilities, data on thermo-and pH/pCO(2) tolerance of fertilisation and development, largely from single stressor physiology and ecotoxicology studies, are placed in a near future climate-relevant setting. Fertilisation exhibited a broad tolerance to warming or acidification beyond stressor values projected for 2100. Early development exhibited susceptibility to warming. For embryos that develop to the larval stage in a warm ocean, hypercapnia and acidification may impair calcification and other physiological processes. Sensitivities will vary between species. Although climate change is potentially dire for the Echinodermata, some species may have a pre-adaptive capacity and this will influence comparative vulnerability to ocean regime change.",No,No,No,No,No,Unrated,Unrated,Unrated,Unrated,Unrated,Natural systems only.                    ,,,
1821748,https://apsis.mcc-berlin.net/scoping/document/193/1821748/,Raising Public Recognition of Climate Change Adaptation to Ensure Food Safety,,Mixed,Maybe,Maybe,Maybe,Maybe,Unrated,Unrated,Unrated,Unrated,Unrated,No abstract available.                    ,,,no abstract
1840566,https://apsis.mcc-berlin.net/scoping/document/193/1840566/,"Urban Development and the Environmental Challenges-""Green"" Systems Considerations for the EU","The increased expansion of urban oriented challenges calls for the need to develop related policies in a sustainable development fashion. This means to be alert to the grand challenges to connect environmental/ecological-social-cultural-economic and technical factors. These challenges exist in all parts of the globalized world, not least in the EU domain. But the different parts of the world will have to find their specific ways to create solutions to these problems. Thus the need for a ""green"" development profile calls for integrated policy making and new ways to reflect on the urban-rural interface which is specific to the environmental, historical, social and technical specificities of the area in focus-e.g. the EU. Related management schemes will have to consider all sorts of environmentally oriented concerns, not least those connected to climate change. In the urban context such considerations have to be long term, systems oriented and resilience reflexive. The forms of decision making, the governance structure and the support measures for such activities have to be given careful attention. This should be done in a spirit of finding a wide range of innovative approaches including not only technical ones, but also those with a social and cultural orientation. In the not too long run such societal transformation strategies will be necessary in the new historical period of the Anthropocene.",No,No,No,No,No,Unrated,Unrated,Unrated,Unrated,Unrated,Does not seem sufficiently empirical                    ,,,
1851410,https://apsis.mcc-berlin.net/scoping/document/193/1851410/,A Novel Optimal Generation Dispatch Algorithm to Reduce the Uncertainty Impact of Renewable Energy,"Climate change can easily affect renewable energy power output, and the uncertainty of renewable generation may cause serious influence on the power grid. This paper proposes a novel optimal generation dispatch algorithm to compensate for the fluctuations in power outputs of renewable energy resources. The proposed method helps reduce bus voltage variation and improves the ability of the power system to adapt to short term changes. The proposed optimal approach is tested on the Arizona transmission system. The proposed algorithm is relevant to transmission system operating and planning studies with a high penetration of renewable energy resources.",No,No,No,No,No,Unrated,Unrated,Unrated,Unrated,Unrated,Mitigation focused                    ,not empirical re responses,,
1945265,https://apsis.mcc-berlin.net/scoping/document/193/1945265/,Infra-Specific Variation Reveals Potential for Adaptation to Ocean Acidification in a Cold-Water Coral from the Gulf of Mexico,"Ocean acidification, the decrease in seawater pH due to the absorption of atmospheric CO2, profoundly threatens the survival of a large number of marine species. Cold-water corals are considered to be among the most vulnerable organisms to ocean acidification because they are already exposed to relatively low pH and corresponding low calcium carbonate saturation states (Omega). Lophelia pertusa is a globally distributed cold-water scleractinian coral that provides critical three-dimensional habitat for many ecologically and economically significant species. In this study, four different genotypes of L. pertusa were exposed to three pH treatments (pH = 7.60, 7.75, and 7.90) over a short (2-week) experimental period, and six genotypes were exposed to two pH treatments (pH = 7.60 and 7.90) over a long (6-month) experimental period. Their physiological response was measured as net calcification rate and the activity of carbonic anhydrase, a key enzyme in the calcification pathway. In the short-term experiment, net calcification rates did not significantly change with pH, although they were highly variable in the low pH treatment, including some genotypes that maintained positive net calcification in undersaturated conditions. In the 6-month experiment, average net calcification was significantly reduced at low pH, with corals exhibiting net dissolution of skeleton. However, one of the same genotypes that maintained positive net calcification (+0.04% day(-1)) under the low pH treatment in the short-term experiment also maintained positive net calcification longer than the other genotypes in the long-term experiment, although none of the corals maintained positive calcification for the entire 6 months. Average carbonic anhydrase activity was not affected by pH, although some genotypes exhibited small, insignificant, increases in activity after the sixth month. Our results suggest that while net calcification in L. pertusa is adversely affected by ocean acidification in the long term, it is possible that some genotypes may prove to be more resilient than others, particularly to short perturbations of the carbonate system. These results provide evidence that populations of L. pertusa in the Gulf of Mexico may contain the genetic variability necessary to support an adaptive response to future ocean acidification.",No,No,No,No,No,Unrated,Unrated,Unrated,Unrated,Unrated,Natural systems focus only.                    ,,,
2039436,https://apsis.mcc-berlin.net/scoping/document/193/2039436/,"Collecting rainwater, a sustainable solution to climate change?","The main problems faced by any city at present are: reduction of natural resources, environmental degradation, increased carbon dioxide, demographic and social changes associated with the urbanization and population growth phenomenon as well as increased frequency and size of floods urban.Stormwater collection is a strategy for adapting to climate change. This strategy has been applied by many civilizations in the history of mankind, pluvial water collection systems have met, for the first time, in areas with long droughts. At present, rainwater collection is gaining interest worldwide, not just to store water during droughts, but also to cope with extreme rainfall, and therefore have a significant impact on rainwater management. An important consequence of climate change is the change in the ratio between periods with extreme rainfall and periods of drought. The city infrastructure is not prepared for these changes, the consequences being accounted for in material damage and health risks to the population. In this paper we aim to highlight the main measures to adapt to climate change from the point of view of pluvial water resources management. © SGEM2018 All Rights Reserved.",Mixed,Maybe,Maybe,Maybe,Maybe,Mixed/Maybe,Unrated,Unrated,Unrated,Maybe,Not clear whether this is empirical. Check full-text.                    ,,,not sure if empirical              
2140809,https://apsis.mcc-berlin.net/scoping/document/193/2140809/,The Great Green Wall for the Sahara and the Sahel Initiative as an opportunity to enhance resilience in Sahelian landscapes and livelihoods,"Over the past 50years, a large number of development initiatives have addressed the diverse social and ecological challenges in the Sahel, often focusing on a single entry point or action, resulting in only a limited degree of success. Within the last decade, the international development discourse has evolved to incorporate resilience thinking as a way to address more complex challenges. However, concrete examples as to how to operationalize resilience thinking are lacking. The Great Green Wall for the Sahara and the Sahel Initiative (GGW), a pan-African program with a strong reforestation focus, is the latest and most ambitious of these development programs to date. The GGW represents an ideal opportunity to apply resilience thinking at a large scale, but in order to do so, it must intelligently gather and centralize pre-existing interdisciplinary knowledge, generate new knowledge, and integrate knowledge systems to appropriately navigate future uncertainties of the diverse social-ecological systems along its path. Herein, after a brief description of large-scale reforestation history in the Sahara and Sahel and the conceptual evolution of the GGW, we propose a transdisciplinary research framework with resilience thinking at its core. It includes analysis of complex social-ecological systems, their temporal and spatial cross-scale interactions, and outcomes focused on the supply of abundant, diverse, equitable, and durable ecosystem services to support livelihoods in the region. If the research areas that comprise the framework were to be properly addressed, they could conceivably guide GGW actions in a way that would contribute to desirable future pathways.",Mixed,Yes,No,Maybe,Maybe,Mixed/Maybe,Maybe,Unrated,Unrated,Maybe,"Difficult to judge whether this provides empirical information. Definitely response-relevant. If there is documentation of the GGW as a changing response mechanism, this could be relevant for D1 and D2.               ",,,
2269102,https://apsis.mcc-berlin.net/scoping/document/193/2269102/,"Floods, landscape modifications and population dynamics in anthropogenic coastal lowlands: The Polesine (northern Italy) case study","It is widely recognized that the complex relationship between humans, soil, and water has become increasingly complicated due to anthropogenic activities, and is further expected to worsen in the future as a result of population dynamics and climate change. The present study aims at shedding light on the multifaceted links between floods, landscape modifications, and population dynamics in anthropogenic coastal lowlands, using a large flood-prone area (the Polesine Region, northeastern Italy) as a significant case study. Based on the analysis of historical events and the results of hydraulic modeling, it is shown that human interventions on both the landscape and the subsoil have substantially altered the flood dynamics, exacerbating hydraulic hazard. Furthermore, the combined analysis of people and assets exposure to inundation reveals that flood risk is not properly taken into account in land-use planning, nor it is properly understood by people living in areas subject to low-probability, high-impact flood events. (c) 2018 Elsevier B.V. All rights reserved.",Mixed,No,No,No,Maybe,Mixed/Maybe,Unrated,Unrated,Unrated,No,Historical rather that contemporary/current.                    ,,,
