id,link,title,content,db1_overall,l.berrangford_db1,apfisch_db1,ee18ivc_db1,miriam_db1,db2_overall,l.berrangford_db2,apfisch_db2,ee18ivc_db2,miriam_db2,l.berrangford_notes,apfisch_notes,ee18ivc_notes,miriam_notes
1277970,https://apsis.mcc-berlin.net/scoping/document/193/1277970/,Waterbird communities adjust to climate warming according to conservation policy and species protection status,"Climate change is one of the strongest biodiversity threats. Worse still, the impact of multiple anthropic stressors on species dynamics could complicate adaptation to temperature increase. International conservation policies aim to protect ecosystems against anthropic pressures, but their ability to facilitate adaptation to climate change has yet to be assessed. Using wetland bird monitoring surveys, we evaluated the differences at the country scale of community adjustment to temperature increase of wintering waterbird communities (145 species) according to the implementation of the two main western Palearctic international conservation policies (Bern Convention and Birds Directive) in the Mediterranean basin (2786 sites, 22 countries) over a 22-year period. We showed that thermic community composition increases over time in countries which have enforced conservation policies. We found that strictly protected species under the Birds Directive and the Bern Convention contributed more to this community adjustment than the not strictly protected species. The mechanism results from a population increase in protected warm-dwelling species but not from a decline in cold-dwelling species. This study supports the ability of international conservation policies to mitigate the effect of climate change on animal communities.",Mixed,Yes,Maybe,Yes,Maybe,Mixed/Maybe,Yes,Unrated,Unrated,No,,,,empirical adaptation initiated by humans (conservation policy/protection) but focused on bird population.                    
1280495,https://apsis.mcc-berlin.net/scoping/document/193/1280495/,"Long-Term Changes in the Composition, Ecology, and Structure of Pinus mugo Scrubs in the Apennines (Italy)","Mountain ecosystems are vulnerable because of land-use and climate change. In this study, we performed a re-visitation study using historical and newly collected vegetation plots to explore the primary trends in the floristic, ecological, and structural features of Mediterranean Pinus mugo krummholz over past decades. The plant community composition over time (1992 vs. 2016-17) was analyzed by a detrended correspondence analysis followed by a statistical comparison of time steps and an analysis of the contribution of each species to temporal differences. Ecological and structural changes were analyzed by a permutational multivariate analysis of variance followed by a post hoc comparison. We observed relevant changes in the floristic composition, structure, and ecological characteristics of Pinus mugo scrub. Some subalpine and treeline species that characterize the early stages of Pinus mugo succession declined as several warm-adapted species increased. Furthermore, these changes were most likely due to the natural evolution of high-mountain krummholz combined with a thermophilization process occurring in alpine habitats. In contrast, a small group of cold-adapted species also increased, probably because the patchy spatial pattern of Pinus mugo scrubs gives rise to mesic patches in a matrix of arid grasslands. The re-visitation approach adopted for long-term analysis in this study can potentially be applied to other mountainous regions to better understand long-term ecological changes in high alpine vegetation.",No,No,No,No,No,Unrated,Unrated,Unrated,Unrated,Unrated,,,,
1283125,https://apsis.mcc-berlin.net/scoping/document/193/1283125/,Facing climate variability in sub-Saharan Africa: analysis of climate-smart agriculture opportunities to manage climate-related risks,"In the literature, a lot of information is available about climate change perceptions and impacts in sub-Saharan Africa. However, there is limited attention in the region to emerging initiatives, technologies and policies that are tailored to building the adaptive capacity of agricultural systems to climate change and variability. In this paper, we discuss the prospects for climate-smart agriculture technologies and enabling policies in dealing with climate change and variability at different sub-regional levels of sub-Saharan Africa to sustain farm productivity and livelihoods of agrarian communities. The review provides substantial information suggesting that without appropriate interventions, climate change and variability will affect agricultural yields, food security and add to the presently unaceptable levels of poverty in sub-Saharan Africa. Although some of them were already existing, the past decades have seen the development and promotion of climate-smart agriculture innovations such as the use of high yielding drought tolerant crop varieties, climate information services, agricultural insurance, agroforestry, water harvesting techniques, integrated soil fertility management practices, etc. In the context of climate change, this appears as a stepping up approach to sustainably improving farm productivity, rural livelihoods and adaptive capacity of farmers and production systems while contributing to mitigation. The development of regional, sub-regional and national climate change policies and plans targeted at mitigating climate change and improving adaptive capacity of the African people have also been developed to enable mainstreaming of climate-smart agriculture into agricultural development plans. Financial commitments from governments and development agencies will be crucial for improving large scale adoption of climate-smart agriculture.",Mixed,No,No,Maybe,No,Unrated,Unrated,Unrated,Unrated,Unrated,Lit review only.    ,,,
1298459,https://apsis.mcc-berlin.net/scoping/document/193/1298459/,Extreme drought hotspot analysis for adaptation to a changing climate: Assessment of applicability to the five major river basins of the Korean Peninsula,"This study proposes a quantitative approach for extreme drought hotspot assessment related to climate change, the hotspot drought risk index (HDRI), and evaluates the response of extreme drought to climate change in the five major river basins of the Korean Peninsula. According to an analysis of seasonal and regional drought characteristics on the Korean Peninsula, drought occurs most frequently in spring, and the central and southern areas are generally more vulnerable to drought. Drought risk analysis under various climate change scenarios indicates significant drought risk over the entire Korean Peninsula excepting some parts of the Han and Nakdong river basins from 2011 to 2040. Extreme drought may be particularly severe in the mid-west area as these basins lack available water resources. Drought risk decreases in the southern Korean Peninsula in the 2011-2040 and 2071-2099 periods, during which the area vulnerable to drought also decreases. However, some parts of central Korea and the western and eastern coastlines remain susceptible to drought. The drought risk evaluation method suggested herein may be useful for predicting drought and establishing realistic coping strategies for extreme drought in a changing climate.",No,No,No,No,No,Unrated,Unrated,Unrated,Unrated,Unrated,               Impacts only     ,,,
1299764,https://apsis.mcc-berlin.net/scoping/document/193/1299764/,Stabilization versus decomposition in alpine ecosystems of the Northwestern Caucasus: The results of a tea bag burial experiment,"Mountainous areas exhibit highly variable decomposition rates as a result of strong local differences in climate and vegetation type. This paper describes the effect of these factors on two major determinants of the local carbon cycle: litter decomposition and carbon stabilization. In order to adequately reflect local heterogeneity, we have sampled 12 typical plant communities of the Russian Caucasus. In order to minimize confounding effects and encourage comparative studies, we have adapted the widely used tea bag index (TBI) that is typically used in areas with low decomposition. By incubating standardized tea litter for a year, we investigated whether (1) initial litter decomposition rate (k) is negatively correlated with litter stabilization (S) and (2) whether k or S exhibit correlations with altitude and other environmental conditions. Our results show that S and k are not correlated. Altitude, pH, and water content significantly influenced the stabilization factor S, while soil-freezing had no influence. In contrast, none of these factors predicted the decomposition rate k. Based on our data, we argue that collection of decomposition rates alone, as is now common practice, is not sufficient to understand carbon input to soils and can potentially lead to misleading results. Our data on community-specific decomposition and stabilization rates further constrain estimates of litter accumulation in subalpine communities and the potential effects of climate change.",No,No,No,No,No,Unrated,Unrated,Unrated,Unrated,Unrated,not response relevant                    ,,,
1305754,https://apsis.mcc-berlin.net/scoping/document/193/1305754/,Climate Change Perceptions and Observations of Agricultural Stakeholders in the Northern Great Plains,"This study explored whether Montana agricultural stakeholders' perceptions and observations of climate change vary according to four socio-ecological variables: income, political view, agricultural occupation, and production region. A survey including 27 questions was developed into five sections: (1) agricultural background information; (2) perceptions about climate change; (3) observed changes in climate-related variables; (4) adaptation practices and strategies; and (5) demographic information. The survey included Likert-scored responses and multiple-choice questions, and was completed by 452 participants, including conventional and organic farmers and ranchers, extension agents, crop consultants, and researchers. The results indicate that while a notable fraction of agricultural stakeholders are alarmed about climate change and optimistic about the human capacity to reduce climate change, the degree of concern and optimism significantly varies depending on the stakeholder's political views, production region, and agricultural occupation group. We found that observations of changes in climate, perceptions about climate change, and potential risks to agricultural production are driven mainly by political views. Both perceptions and observations drive the choice of adaptation and mitigation practices. It is thus essential to understand farmers' socio-ecological characteristics when designing agricultural outreach programs in order to reduce barriers for the adoption of climate-resilient agriculture.",Mixed,Yes,Maybe,Yes,Yes,Mixed/Maybe,Maybe,No,Unrated,Maybe,Not clear whether the adaptation responses go beyond adaptive capacity and are directly risk reducing. Check full text.                    ,"reports on perception not response, although recognizes that perception drives adaptation.                   ",,not sure if qualified for database 2
1386012,https://apsis.mcc-berlin.net/scoping/document/193/1386012/,Potential occurrence of Zika from subtropical to temperate Argentina considering the basic reproduction number (R-0),"Objective. To assess the potential occurrence of Zika transmission throughout Argentina by the mosquito Aedes aegypti considering the basic reproduction number (R-0). Methods. A model originally developed for dengue was adapted for Zika. R-0 was estimated as a function of seven parameters, three of them were considered temperature-dependent. Seasonal Zika occurrence was evaluated in 9 locations representing different climatic suitability for the vector. Data of diary temperatures were extracted and included in the model. A threshold of R-0 =1 was fixed for Zika occurrence. Sensitivity analyses were performed to evaluate the uncertainty around the results. Results. Zika transmission has the potential to occur in all studied locations at least in some moment of the year. In the northern region, transmission might be possible throughout the whole year or with an interruption in winter. The maximum R-0 was estimated in 6.9, which means an average of 7 secondary cases from a primary case. The probabilistic sensitivity analysis showed that during winter the transmission can only be excluded in the southern fringe of geographic distribution of the vector and in part of central Argentina. Conclusion. Zika virus has the potential to be transmitted in Argentina throughout the current geographic range of the mosquito vector. Although the transmission would be mainly seasonal, the possibility of winter transmission cannot be excluded in northern and central Argentina, meaning that there is a potential endemic maintenance of the disease.",No,No,No,No,No,Unrated,Unrated,Unrated,Unrated,Unrated,impacts focused                    ,,,
1424482,https://apsis.mcc-berlin.net/scoping/document/193/1424482/,Response to cold acclimation in diapause pupae of Hyles euphorbiae (Lepidoptera: Sphingidae): candidate biomarker identification using proteomics,"The distribution range of Hyles euphorbiae covers distinct climates across the Palaearctic. Previous investigations showed a correlation between mitochondrial DNA identity of populations and climatic conditions related to winter; however, the lack of biomarkers hampers investigations to test whether geographically distinct populations do show specific molecular responses to low temperatures or whether they possess specific genetic identity at loci functionally related to cold response. The present study was designed to identify candidate protein biomarkers and biological processes that are associated with cold acclimation of overwintering H. euphorbiae diapause pupae. Specimens taken from a single central European population were gradually cooled from 20 degrees C to -2 degrees C over 36 days and 12 differentially abundant proteins were identified. In addition, DeepSuperSAGE sequencing technology was applied to study differentially regulated genes. There was incongruence between differentially abundant proteins and differentially expressed genes, but functional characteristics of regulated proteins and analyses of gene ontology term enrichment among differentially regulated genes pointed to activation of the same biological processes, e. g. oxidative stress response. As proteins represent biologically active molecules, candidate biomarkers derived from proteomics are considered well suited to explore intraspecific patterns of local adaptation to different climates.",No,No,No,No,No,Unrated,Unrated,Unrated,Unrated,Unrated,,,,
1433405,https://apsis.mcc-berlin.net/scoping/document/193/1433405/,Designing climate-resilient rice with ideal grain quality suited for high-temperature stress,"To ensure rice food security, the target outputs of future rice breeding programmes should focus on developing climate-resilient rice varieties with emphasis on increased head rice yield coupled with superior grain quality. This challenge is made greater by a world that is increasingly becoming warmer. Such environmental changes dramatically impact head rice and milling yield as well as increasing chalkiness because of impairment in starch accumulation and other storage biosynthetic pathways in the grain. This review highlights the knowledge gained through gene discovery via quantitative trait locus (QTL) cloning and structural-functional genomic strategies to reduce chalk, increase head rice yield, and develop stable lines with optimum grain quality in challenging environments. The newly discovered genes and the knowledge gained on the influence of specific alleles related to stability of grain quality attributes provide a robust platform for marker-assisted selection in breeding to design heat-tolerant rice varieties with superior grain quality. Using the chalkiness trait in rice as a case study, we demonstrate here that the emerging field of systems genetics can help fast-track the identification of novel alleles and gene targets that can be pyramided for the development of environmentally robust rice varieties that possess improved grain quality.",Mixed,Yes,No,Maybe,Maybe,Mixed/Maybe,Maybe,Unrated,Unrated,Maybe,This is response-related and human-assisted. I would want to go back to the full text to see that there is really empirical response with direct risk reducing potential here.                    ,,,  unsure if empirical 
1456243,https://apsis.mcc-berlin.net/scoping/document/193/1456243/,Informed Consent for Vaginal Delivery Is It Time to Revisit the Shared Decision-Making Process?,"BACKGROUND: Vaginal delivery as we know it today has evolved, with increasing recognition of trauma to the pelvic floor and perineum. Evolutionary adaptation of the human female pelvis to vaginal deliveries brings with it many benefits, but risks still exist. These benefits and risks should be discussed with patients prior to delivery. Currently, no consensus exists on a standard informed consent process prior to normal vaginal delivery. OBJECTIVES: To synopsize the current literature regarding the ethics of informed consent in the setting of obstetric and gynecological practice, and to make the case for informed consent for vaginal delivery prior to labor. DISCUSSION: Vaginal birth is still viewed as the default method of delivery. The reason for this is not unrelated to the direct connection between the uterus that holds the fetus before labor, and the vagina, for which the term birth canal was given even before modern obstetrics. Although there are known benefits for advocating vaginal births, there are also attendant risks. CONCLUSION: It is incumbent on obstetricians and midwives to discuss those risk and benefits with their patient prior to labor. Verbal discussion without documentation may no longer be appropriate due to medical advancements and the litigious health care climate. For this reason, we argue for and advocate that a consent process be included as an educational measure and as part of our ethical obligation to provide care.",No,No,No,No,No,Unrated,Unrated,Unrated,Unrated,Unrated,not climate-related                    ,,,
1475397,https://apsis.mcc-berlin.net/scoping/document/193/1475397/,Evaluating the role and measures of juvenile growth rate: latitudinal variation in insect life histories,"Latitudinal and elevational trends in body size are found in numerous animal taxa, with various adaptive explanations proposed. It is however debatable whether geographic trends in adult body size are accompanied by corresponding differences in juvenile growth rate (= mass gain per unit time). Respective studies have been complicated by conceptual and methodological problems related to defining and measuring this variable, particularly in organisms with discontinuous growth like arthropods. Using an original method for estimating differential (instantaneous) juvenile growth rates, we compared geographically distant European populations of six insect species in a common garden experiment. We found no among population differences in differential growth rate in any of the species. This result is in concert with concurrent increase in both adult size and developmental time towards the south. While opposite examples exist, we interpret our results as challenging the view that growth rate is a trait that readily responds to environmentally based selective pressures. Our results thus advocate the more classical view of growth rate maximisation within its physiological limits. We discuss the advantages of using differential (rather than integral) measures of growth rate in evolutionary ecological studies and evaluate the reasons for the detected latitudinal trends in life history traits.",No,No,No,No,No,Unrated,Unrated,Unrated,Unrated,Unrated,Irrelevant                    ,,,
1529701,https://apsis.mcc-berlin.net/scoping/document/193/1529701/,Application and verification of the soil-ecological index for assessing soil cover patterns on plowlands,"The reformation of Russian agriculture and the development of landscape-adaptive agricultural systems have generated interest in the agroecological aspects of studying soil cover patterns. The qualitative evaluation of soil resources is necessary for objective comparison of their quality at the landscape, regional, and interregional levels. The applicability of the soil-ecological index (SEI) as an integral criterion for quality assessment of soils, soil associations, and soil cover patterns on the basis of a common all-Russia scale has been experimentally verified on test plots. This index can also be applied for assessing the degree of contrast in the soil cover. The analysis of different soil-climatic regions in the European part of Russia has shown that the SEI value is well correlated with the soil-climatic conditions. However, for a particular farm, the climatic component of the SEI becomes equal for all the fields. At the same time, the soil properties and geomorphic conditions limiting soil fertility are usually different for different soil combinations, and they become essential upon calculation of the SEI for the particular field. Feasibility of verification and correction of the calculated SEI on the basis of experimental data is shown. This makes it possible to find better-grounded decisions on the agrotechnologies applicable for a given field.",No,No,No,No,No,Unrated,Unrated,Unrated,Unrated,Unrated,Not climate change related                    ,,,
1537739,https://apsis.mcc-berlin.net/scoping/document/193/1537739/,The out-of-the-delta hypothesis: dense human populations in low-lying river deltas served as agents for the evolution of a deadly pathogen,"Cholera is a diarrheal disease that has changed the history of mankind, devastating the world with seven pandemics from 1817 to the present day. Although there is little doubt in the causative agent of these pandemics being Vibrio cholerae of the O1 serogroup, where, when, and how this pathogen emerged is not well understood. V. cholerae is a ubiquitous coastal species that likely existed for tens of thousands of years. However, the evolution of a strain capable of causing a large-scale epidemic is likely more recent historically. Here, we propose that the unique human and physical geography of low-lying river deltas made it possible for an environmental bacterium to evolve into a deadly human pathogen. Such areas are often densely populated and salt intrusion in drinking water frequent. As V. cholerae is most abundant in brackish water, its favored environment, it is likely that coastal inhabitants would regularly ingest the bacterium and release it back in the environment. This creates a continuous selection pressure for V. cholerae to adapt to life in the human gut.",No,No,No,No,No,Unrated,Unrated,Unrated,Unrated,Unrated,Not climate change relevant                    ,,,
1547679,https://apsis.mcc-berlin.net/scoping/document/193/1547679/,Protected cultivation of vegetable crops in sub-Saharan Africa: limits and prospects for smallholders. A review,"Vegetable production in sub-Saharan Africa faces numerous agronomic constraints that will have to be overcome to feed the increasing population and to fight malnutrition. Technology transfer and the adoption of low-tech protected cultivation techniques affordable for smallholders are believed to be able to meet this challenge. Protected cultivation techniques are a set of agricultural practices aimed at artificializing the crop environment through the use of soil covers and/or plant covers to control pests and climatic conditions. Although protected cultivation techniques may increase the yield and quality of vegetable crops and extend their production periods worldwide, the transfer of these techniques in sub-Saharan Africa raises questions about their agronomical performances, their profitability but also their environmental impacts. Are low-tech protected cultivation techniques adapted to the sustainable production of vegetables by smallholders in sub-Saharan Africa? To answer this question, we present an overview of the agronomic, economic, and environmental performances of low-tech protected cultivation techniques in sub-Saharan Africa as reported in the literature. The major conclusions that can be drawn from the review are (1) low-tech protected cultivation techniques are not suitable in all climatic conditions in sub-Saharan Africa and need to be combined with other methods to ensure adequate pest control, (2) the profitability of protected cultivation techniques relies on the capacity to offset increased production costs by higher yields and higher selling prices to be obtained with off-season and/or higher quality products, (3) breaking with existing cropping systems, the lack of technical support and skills, and the limited access to investment funding are major obstacles to the adoption of protected cultivation techniques by smallholders (4) life cycle assessments conducted in northern countries suggested that more efficient use of agricultural inputs would offset the negative impacts of protected cultivation techniques if they are properly managed, but further studies are required to be sure these results can be extrapolated to sub-Saharan Africa context.",Mixed,Yes,No,Maybe,Maybe,Mixed/Maybe,No,Unrated,Unrated,Maybe,"Is response-related/relevant, but not clear if this is truly empirical. Based on review of empirical literature, and not conceptual, though.                    ",,,review. not sure if counts as empirical                     
