id,link,title,content,db1_overall,l.berrangford_db1,apfisch_db1,ee18ivc_db1,miriam_db1,db2_overall,l.berrangford_db2,apfisch_db2,ee18ivc_db2,miriam_db2,l.berrangford_notes,apfisch_notes,ee18ivc_notes,miriam_notes
44683,https://apsis.mcc-berlin.net/scoping/document/193/44683/,Raising awareness about climate change in Pacific communities,"Community-based climate change projects in the Pacific typically seek to raise the awareness of locals about the consequences of climate change and changing weather patterns. A key concern is that such activities might be done in an ad hoc manner, with little consideration of local relevance, audience and the integration of local experiences and knowledge. Drawing on the results gleaned from an interactive focus group with 10 climate change practitioners working in the region, this exploratory study investigates why raising awareness about climate change remains crucial, and importantly, how such activities might be done in a more relevant, meaningful and empowering way at the community level in the Pacific. This commentary argues that it is essential for communities to make local sense of climate change, particularly in an ever-changing world where knowledge is continuously expanding and changing. Initial findings suggest that making local sense of and raising awareness about climate change readily comes about with due consideration of approach, audience and context.",Mixed,Yes,Maybe,Yes,No,Mixed/Maybe,No,No,Yes,Unrated,,,,
49638,https://apsis.mcc-berlin.net/scoping/document/193/49638/,"Translating Climate Change: Adaptation, Resilience, and Climate Politics in Nunavut, Canada","This article examines the translation of key terms about climate change from English into Inuktitut, considering not only their literal translation but also the broader context within which words make sense. We argue that notions of resilience, adaptation, and climate change itself mean something fundamentally different in Inuktitut than English and that this has implications for climate policy and politics. To the extent that climate change is translated into Inuktitut as a wholly environmental phenomenon over which humans have no control, both adaptation and resilience come to be seen as appropriate and distinctly Inuit modes of relating to shifting climatic conditions, calling on practices of patience, observation, creativity, forbearance, and discretion. If translated as a matter of unethical harm of sila, however, Inuit frameworks of justice, relationality, and healing would be activated. In the context of a broader global shift away from mitigation and toward enhancing the adaptive capacities and resilience of particular populations, current modes of translating climate change, we argue, are deeply political.",No,No,No,No,No,Unrated,Unrated,Unrated,Unrated,Unrated,,,,
64887,https://apsis.mcc-berlin.net/scoping/document/193/64887/,A decision framework for Integrated Assessment Modelling of air quality at regional and local scale,"Decision making in the field of air quality and greenhouses gases reductions can nowadays be supported by a clear overall framework and by computer tools that integrate the most relevant aspects of the problem. This approach is particularly important at local scale since new general rules on emission abatement at European level can only marginally modify the most critical hotspots and may be very costly. This paper adapts the general Drivers, Pressures, State, Impacts, Responses (DPSIR) scheme proposed by the European Environment Agency to the specific case of local air quality policies and shows how the most recent scientific developments in impact evaluation and social acceptance can be integrated. The proposed decision framework represents a general methodology to design Integrated Assessment Modelling (IAM) systems aimed at the implementation of effective Air Quality Plans (AQP). An extensive survey across European countries shows the current degree of adoption of these approaches. (C) 2016 Elsevier Ltd. All rights reserved.",No,No,No,No,No,Unrated,Unrated,Unrated,Unrated,Unrated,,,,
77756,https://apsis.mcc-berlin.net/scoping/document/193/77756/,"Quantifying vulnerability of rural communities to flooding in SSA: A contemporary disaster management perspective applied to the Lower Shire Valley, Malawi","In response to the increasing frequency and economic damages of natural disasters globally, disaster management has evolved significantly to incorporate vulnerability assessments that are multi-dimensional, integrated and metric-based. This is to support knowledge-based decision making and hence sustainable disaster risk reduction. In Malawi and most of Sub-Saharan Africa (SSA), however, flood vulnerability assessments mainly focusing on social vulnerability, have been largely qualitative. The subjective nature of such qualitative assessments makes their use for identifying relative vulnerabilities of specific people and places, targeting of interventions, allocation of scarce resources and monitoring of benefits that may arise from interventions extremely problematic. Viewing vulnerability through exposure, susceptibility and capacity dimensions, all linked to social, economic, physical and environmental factors, this study has used an index-based approach to quantify and profile vulnerability to flooding of rural, subsistent communities in the Lower Shire Valley, Malawi. Results show that vulnerability to flooding is susceptibility-driven with susceptibility magnitudes manifesting as high to very high. In particular, socio-economic and to a large extent environmental susceptibilities are predominantly high to very high. Economic and physical capacities tend to be low but societal capacity tends to be high thereby attenuating overall capacity-induced vulnerability to medium levels. Physical exposure is medium. Except for environmental vulnerability, spatial differentiation in all forms of vulnerability across communities is in general marginal. (C) 2015 Elsevier Ltd. All rights reserved",Mixed,Yes,No,No,No,Mixed/Maybe,No,Unrated,Unrated,Unrated,,,,
88908,https://apsis.mcc-berlin.net/scoping/document/193/88908/,The effect of long-term drying associated with experimental drainage and road construction on vegetation composition and productivity in boreal fens,"Land-use and climate change are expected to cause drying of vegetation and surface soils in continental boreal peatlands. We examined the effects of multi-decadal drying and drainage on plant community structure and productivity in four fens located in Alberta, Canada. Long-term drying resulted in a two to fourfold increase in total biomass in three of the four fen sites, with a similar large increase in NPP in Treed Fen 1. The treed poor fens consistently had decreased moss cover and productivity with drainage. Across all sites, changes in understory community composition were related to the change in water table position as well as overstory canopy development that occurred post-drainage. Overall, drainage induced a shift toward a drier peatland regime, favoring increased canopy and vascular plant density at the expense of ground-layer mosses or the understory. Within the ground layer communities, drainage favored dry-adapted hummock moss and lichen species over those wet-adapted but dessication-prone species typical of low-lying lawns and hollows. Alteration of fen vegetation due to ecosystem drying will not only influence carbon sequestration but also will increase the vulnerability of peatlands to wildfire, increasing the risk of further ecosystem degradation and possible loss of resilience.",No,No,No,No,No,Unrated,Unrated,Unrated,Unrated,Unrated,,,,
96092,https://apsis.mcc-berlin.net/scoping/document/193/96092/,From the circular economy to a green economy. Note 1. Chitin Nanofibrils as natural by-products to manage the human and environment ecosystems,"The transition to a high level of human development has created a negative ecological footprint, putting a disproportionate burden on the environment. Thus the necessity for increasing the resource efficiency, minimizing both harmful greenhouse gas emissions and waste material, to transform the actual circular economy to a green economy with waste near to zero. The transition to a green economy could reduce the risks of global climate changes and ameliorate the energy security, because of its capacity to use in a better way both natural resources and waste materials. The annual cost in natural capital degradation, in fact, is estimated at US$ 7.3 trillion, almost six time the cost of greening the economy, while ∼2 billion tons of wasted food is produced on the planet together with 50 million tons of electrical waste. Therefore, the necessity to change our way of living is a must of our society. Among the use of industrial by-products, a major use of raw materials, as chitin nanofibrils obtained from crustaceans waste, will certainly contribute to accelerate the passage from a circular economy to a green economy, safeguarding the planet biodiversity also. Data and examples of this use will be reported.",Mixed,No,No,No,Maybe,Unrated,Unrated,Unrated,Unrated,Unrated,,,,"can’t tell if this is empirical
under some definitions a new waste management product could be adaptive "
110619,https://apsis.mcc-berlin.net/scoping/document/193/110619/,Proteomic Techniques and Management of Flooding Tolerance in Soybean,"Climate change is considered a major threat to world agriculture and food security. To improve the agricultural productivity and sustainability, the development of high-yielding stress-tolerant, and climate-resilient crops is essential. Of the abiotic stresses, flooding stress is a very serious hazard because it markedly reduces plant growth and grain yield. Proteomic analyses indicate that the effects of flooding stress are not limited to oxygen deprivation but include many other factors. Although many flooding response mechanisms have been reported, flooding tolerance mechanisms have not been fully clarified for soybean. There were limitations in soybean materials, such as mutants and varieties, while they were abundant in rice and Arabidopsis. In this review, plant proteomic technologies are introduced and flooding tolerance mechanisms of soybeans are summarized to assist in the improvement of flooding tolerance in soybeans. This work will expedite transgenic or marker-assisted genetic enhancement studies in crops for developing high-yielding stress-tolerant lines or varieties under abiotic stress.",Mixed,No,Maybe,No,Maybe,Mixed/Maybe,Unrated,Maybe,Unrated,Unrated,,,,
188512,https://apsis.mcc-berlin.net/scoping/document/193/188512/,Agro-climatic adaptation of cropping systems under climate change in Shanghai,"Climate change affects the heat and water resources required by agriculture, thus shifting cropping rotation and intensity. Shanghai is located in the Taihu Lake basin, a transition zone for various cropping systems. In the basin, moderate climate changes can cause major shifts in cropping intensity and rotation. In the present study, we integrated observational climate data, one regional climate model, land use maps, and agricultural statistics to analyze the relationship between heat resources and multi-cropping potential in Shanghai. The results of agro-climatic assessment showed that climate change over the past 50 years has significantly enhanced regional agroclimatic resources, rendering a shift from double cropping to triple cropping possible. However, a downward trend is evident in the actual multi-cropping index, caused principally by the increasing costs of farming and limitations in the supply of labor. We argue that improving the utilization rate of the enhanced agro-climatic resources is possible by introducing new combinations of cultivars, adopting more laborsaving technologies, and providing incentives to farmers.",Mixed,Yes,No,Maybe,Maybe,Mixed/Maybe,No,Unrated,Unrated,Unrated,,,,"assessment, seems like just arguing for an adaptation use case             "
222427,https://apsis.mcc-berlin.net/scoping/document/193/222427/,Heat wave effects on biomass and vegetative growth of macrophytes after long-term adaptation to different temperatures: a mesocosm study,"Elevated temperatures and extreme climatic events, such as heat waves, can negatively affect submerged macrophytes. Here, we investigated how submerged macrophytes adapted to 3 different temperatures (ambient, ca. + 3 degrees C and ca. + 4.5 degrees C) responded to a heat wave. After 10 yr of adaptation, the shoots of 2 species of submerged macrophytes, Elodea canadensis and Potamogeton crispus, were collected from each of the 3 temperature treatments and transferred to 2 heated treatments for 1 mo. The 2 heated treatments were then exposed to a 1 mo heat wave with an additional 5 degrees C temperature increase. For P. crispus, total biomass did not differ among the plants adapted to the different temperatures or between the 2 heated treatments for the duration of the experiment. Plants adapted to the highest temperatures, however, produced a larger number of smaller turions before the heat wave and allocated less biomass to elongation before and after the heat wave. For E. canadensis, the plants adapted to higher temperatures had higher total biomass before and during the heat wave and allocated more biomass to roots and leaves during the heat wave. Most indicators (e.g. length and biomass) of macrophyte performance measured during the experiment did not differ between the 2 heated treatments. In summary, after the 10 yr adaptation to higher temperatures, the submerged macrophytes showed adaptive changes in growth and asexual reproduction and responded in a complex way to the heat wave depending on species, growth status and adaptation temperature.",No,No,No,No,No,Unrated,Unrated,Unrated,Unrated,Unrated,,,,non-human adaptation                     
225751,https://apsis.mcc-berlin.net/scoping/document/193/225751/,Simplified modelling of apple flowering phenology for application in climate change scenarios,"Plant phenology has a strong sensitivity to temperature and therefore high relevance to document responses to climate change. Flowering phenology plays a major role as a relevant set-point (i.e., biofix) in tree fruit pest and disease modelling. Projected climate change largely affects the range and phenology of pests and diseases, which requires adaptations of plant protection strategies to maintain their sustainability. The aim of the present study was (1) to elucidate a change in apple fruit phenology during the last decades and (2) to develop a simple heating model that only relies on present-year accumulated temperature sums. The results showed that apple flowering advanced on average 3.1 days/decade from 1960 to 2010. From 1981 to 2011, full bloom even advanced on average 5.1 days/decade. These shifts are similar to other phenological events of temperate deciduous trees reported in literature. For beginning of flowering, full bloom, and flowering termination (BBCH 60, 65, 69), the variation in temperature sums (coefficient of variation) was smallest for forcing day of year (DOY) 45 and forcing temperature threshold of 0°C. The corresponding temperature sums from DOY 45 were 10368 degree-hours (°h) (BBCH 60), 12546°h (BBCH 65), and 15914°h (BBCH 69). For BBCH 60 and 65, the validation of the simplified heating model for apple flowering revealed a good relationship between observed DOY and simulated DOY across all years and sites. Those models are simple, do not rely on data of the previous year and are therefore easily applicable in climate change scenarios, for pest and disease simulations.",No,No,No,No,No,Unrated,Unrated,Unrated,Unrated,Unrated,,,,
241264,https://apsis.mcc-berlin.net/scoping/document/193/241264/,"Disease outbreaks, bleaching and a cyclone drive changes in coral assemblages on an inshore reef of the Great Barrier Reef","Coral disease is a major threat to the resilience of coral reefs; thus, understanding linkages between disease outbreaks and disturbances predicted to increase with climate change is becoming increasingly important. Coral disease surveys conducted twice yearly between 2008 and 2011 at a turbid inshore reef in the central Great Barrier Reef spanned two disturbance events, a coral bleaching event in 2009 and a severe cyclone (cyclone 'Yasi') in 2011. Surveys of coral cover, community structure and disease prevalence throughout this 4-yr study provide a unique opportunity to explore cumulative impacts of disturbance events and disease for inshore coral assemblages. The principal coral disease at the study site was atramentous necrosis (AtN), and it primarily affected the key inshore, reef-building coral Montipora aequituberculata. Other diseases detected were growth anomalies, white syndrome and brown band syndrome. Diseases affected eight coral genera, although Montipora was, by far, the genus mostly affected. The prevalence of AtN followed a clear seasonal pattern, with disease outbreaks occurring only in wet seasons. Mean prevalence of AtN on Montipora spp. (63.8 % +/- A 3.03) was three- to tenfold greater in the wet season of 2009, which coincided with the 2009 bleaching event, than in other years. Persistent wet season outbreaks of AtN combined with the impacts of bleaching and cyclone events resulted in a 50-80 % proportional decline in total coral cover. The greatest losses of branching and tabular acroporids occurred following the low-salinity-induced bleaching event of 2009, and the greatest losses of laminar montiporids occurred following AtN outbreaks in 2009 and in 2011 following cyclone Yasi. The shift to a less diverse coral assemblage and the concomitant loss of structural complexity are likely to have long-term consequences for associated vertebrate and invertebrate communities on Magnetic Island reefs.",No,No,No,No,No,Unrated,Unrated,Unrated,Unrated,Unrated,,,,
261525,https://apsis.mcc-berlin.net/scoping/document/193/261525/,Summer evapotranspiration in western Siberia: a comparison between eddy covariance and Penman method formulations,"Evapotranspiration is difficult to quantify because of the many factors and complex processes that influence it. Several empirical methods have been developed over the years to estimate potential evapotranspiration based on easily available parameters. Directly measured data of actual evapotranspiration have been rather sparse in the past and still need to be improved in particular regions like western Siberia. The transition zone between the warm temperate and cold temperate continental climates is very sensitive to climate change, and water stress is an increasingly important issue in these regions with a highly dynamic agricultural activity. So there is a growing need to estimate actual evapotranspiration. Widely usable approximations are needed. In this study, the values of potential evapotranspiration computed with the original version, and eight modifications of the Penman formulation were compared and related to the actual evapotranspiration measured by eddy covariance over a grassland area in western Siberia. The original 1948 and 1963 Penman formulations are best for estimating potential evapotranspiration in the transition zone between the forest steppes and the pre-taiga. A nearly linear relationship between the potential and actual evapotranspiration was found. A simple modification of the Penman equation (i.e. the multiplication of the result by a factor of 0.47) is suggested for approximating the actual evapotranspiration based on standard meteorological data for the region. The original Penman formulation is most robust and will provide the widest applicability in the future under changing climate and environmental conditions. In this context, it is further recommended not to neglect the ventilation term of the Penman equation, which is often assumed to be negligibly small. A detailed correlation analysis showed that under dry soil conditions, the vegetation largely contributed to the actual evapotranspiration and, in contrast to widely held expectations, that the Penman equation is best adapted to vegetated surfaces. Copyright (c) 2015 John Wiley & Sons, Ltd.",No,No,No,No,No,Unrated,Unrated,Unrated,Unrated,Unrated,,,,
264144,https://apsis.mcc-berlin.net/scoping/document/193/264144/,Towards sustainable lifestyles. A variety of lifestyles for a post-carbon society,"In 2009 a programme -""Re-thinking Society in a Post-carbon Society""- steered jointly by the Foresight Department of the French Ecology Ministry and the French Environment and Energy Management Agency (ADEME), was launched in France. It is still ongoing and aims to produce a final report in 2013. The idea of a transition towards a ""postcarbon"" society includes four main objectives: reducing greenhouse gas emissions by 2050 to one quarter of what they were in 1990; near-autonomy with regard to carbon energies (petrol, gas, coal); an adequate capacity to adapt to climate change and, lastly, greater attention to situations of ""energy precariousness"". As part of the dossier Futuribles is devoting to this programme this month, Andreas Huber, Sébastien Girard and Pierre Le Marre lay out in this article the results of the studies they have carried out on ""sustainable urban milieus"". After a presentation of the notion of ""milieu"" (based here on a segmentation using the Socio-milieus® method) and of the typology employed (nine main social milieus, three emergent milieus and 16 contrasting profiles), the authors show the extent to which individuals' carbon footprints vary, depending upon lifestyles, and what a determining effect these lifestyles have in the fields of housing and transport. They then specify the various factors influencing behaviour in the direction of sustainable consumption (or not) and the different types of strategies of intervention that are likely to modify those behaviours. Lastly, they detail two targeted strategies, one aimed at the ""precarious seniors"" milieu and the other at the ""eco-elite"" milieu. Despite certain imperfections that remain to be sorted out in the study of sustainable urban milieus, these studies open up new perspectives for the development of sociologically targeted policies for a post-carbon transition.",No,No,No,No,No,Unrated,Unrated,Unrated,Unrated,Unrated,,,,mitigation    
272955,https://apsis.mcc-berlin.net/scoping/document/193/272955/,"Effect of climatic factors such as temperature, precipitation on maize production in China","Impacts of climate change on agriculture has received wide concerns globally, yet a number of questions such as how past climate change affected the crop yields, which climatic variables were the main contributor for observed yield reduction remained unanswered to date, particularly in developing countries. Information about the climatic risks posed on crop growth, and yield responses to the specific climatic risks is prerequisite for understanding the underlying mechanisms of climate change impacts and devising appropriate adaptation strategies. This study first identified the changes of growing-season climatic variables (temperature, precipitation, and solar radiation) from 1982-2006 for China's maize production. Using the relationships between changes in survey maize yield and climatic variables and their spatial variations, we investigated and untangled the impacts of different climatic variables on maize yield. Our analysis demonstrated that the growing-season temperatures, including daily maximum, minimum and mean temperatures, exhibited significant increase during 1981-2006, indicating the potential climatic risks for maize growth in China. Growing-season diurnal temperature range, precipitation and solar radiation also exhibited detectable changes, but limited to small parts of the maize area. During 1981-2006, there were significant negative correlations between national maize yield and temperatures (include mean, maximum, and minimum temperatures). Maize yield in some maize areas also exhibited linear correlation relationship to growing-season diurnal temperature range, solar radiation, and precipitation. With a 1℃ warming in growing-season temperature, 1℃ increase in diurnal temperature range, a 10% decrease in radiation and precipitation, much of the maize area showed detectable yield response to these changes. Maize experienced depressed yield to the 1℃ warming in growing-season temperature, denoting by roughly a quarter of China's maize area exhibiting depressed yield and an estimated reduction of 25.1% across the regions that have detectable negative yield responses. The four climatic variables have diverse impacts on the maize yield in terms of the magnitude of yield change and the spatial variation of yield response. We identified the key climatic factor for observed maize yield change for all maize area. Temperature appeared as the first key climatic driver for maize yield change in over 40% maize area, while diurnal temperature range acted as a main player in 23% maize area. Radiation and precipitation shared a small and similar portion of maize area for playing as the key climatic variables for the yield response. We recognized the uncertainties in our study some of which came from reliability of data resource and the use of statistical method. However, this study provided first hand information on maize yield response to historical climatic risks, which advanced the understanding of underlying mechanism of climate change impacts on China's maize production and assisted the projection of maize yield for future climate change. ©, 2014, Chinese Society of Agricultural Engineering. All right reserved.",No,No,No,No,No,Unrated,Unrated,Unrated,Unrated,Unrated,,,,
