id,link,title,content,db1_overall,l.berrangford_db1,apfisch_db1,ee18ivc_db1,miriam_db1,db2_overall,l.berrangford_db2,apfisch_db2,ee18ivc_db2,miriam_db2,l.berrangford_notes,apfisch_notes,ee18ivc_notes,miriam_notes
721582,https://apsis.mcc-berlin.net/scoping/document/193/721582/,"Neurobehavioral Deficits, Diseases, and Associated Costs of Exposure to Endocrine-Disrupting Chemicals in the European Union","Context: Epidemiological studies and animal models demonstrate that endocrine-disrupting chemicals (EDCs) contribute to cognitive deficits and neurodevelopmental disabilities. Objective: The objective was to estimate neurodevelopmental disability and associated costs that can be reasonably attributed to EDC exposure in the European Union. Design: An expert panel applied a weight-of-evidence characterization adapted from the Intergovernmental Panel on Climate Change. Exposure-response relationships and reference levels were evaluated for relevant EDCs, and biomarker data were organized from peer-reviewed studies to represent European exposure and approximate burden of disease. Cost estimation as of 2010 utilized lifetime economic productivity estimates, lifetime cost estimates for autism spectrum disorder, and annual costs for attention-deficit hyperactivity disorder. Setting, Patients and Participants, and Intervention: Cost estimation was carried out from a societal perspective, ie, including direct costs (eg, treatment costs) and indirect costs such as productivity loss. Results: The panel identified a 70-100% probability that polybrominated diphenyl ether and organophosphate exposures contribute to IQ loss in the European population. Polybrominated diphenyl ether exposures were associated with 873 000 (sensitivity analysis, 148 000 to 2.02 million) lost IQ points and 3290 (sensitivity analysis, 3290 to 8080) cases of intellectual disability, at costs of (sic) 9.59 billion (sensitivity analysis, (sic)1.58 billion to (sic)22.4 billion). Organophosphate exposures were associated with 13.0 million (sensitivity analysis, 4.24 million to 17.1 million) lost IQ points and 59 300 (sensitivity analysis, 16 500 to 84 400) cases of intellectual disability, at costs of (sic)146 billion (sensitivity analysis, (sic)46.8 billion to (sic)194 billion). Autism spectrum disorder causation by multiple EDCs was assigned a 20-39% probability, with 316 (sensitivity analysis, 126-631) attributable cases at a cost of (sic)199 million (sensitivity analysis, (sic)79.7 million to (sic)399 million). Attention-deficit hyperactivity disorder causation by multiple EDCs was assigned a 20-69% probability, with 19 300 to 31 200 attributable cases at a cost of (sic)1.21 billion to (sic)2.86 billion. Conclusions: EDC exposures in Europe contribute substantially to neurobehavioral deficits and disease, with a high probability of >(sic)150 billion costs/year. These results emphasize the advantages of controlling EDC exposure.",No,No,No,No,No,Unrated,Unrated,Unrated,Unrated,Unrated,,,,
746124,https://apsis.mcc-berlin.net/scoping/document/193/746124/,Climate change and thermal comfort in Southern Europe housing: A case study from Lisbon,"The world has been experiencing a significant increase in daily average temperatures per decade and climate change scenarios are projecting high probability of more frequent heat waves. In vulnerable regions, like Southern Europe, where most of the residential buildings still rely on natural ventilation for cooling, impact on thermal comfort can be significant in terms of health, well-being and also energy consumption. The question is particularly important for the existing building stock, which was not designed considering the projected future climate conditions and is prone to be subjected to interventions with the purpose of improving thermal. performance. The study presents a vulnerability framework and methodology for the assessment of thermal comfort in existing dwellings in the context of climate change. Results relating to a 1960s typical building case study in Lisbon, Portugal, suggest that specific dwelling characteristics, such as orientation, and occupancy profiles are relevant when assessing vulnerability, suggesting significant differences, of up to 91% in discomfort hours on an annual basis. Furthermore, increased insulation seems to be effective in decreasing discomfort, as the best results (48% in discomfort hours decrease) stem from a context of external insulation for a heatwave situation. The methodology can be useful for assessing vulnerability in existing dwellings and its specific conditions. It can also contribute to understanding the effect of energy retrofitting measures in future climate conditions, assisting energy efficiency policies and decision-making regarding retrofit interventions. (C) 2015 Elsevier Ltd. All rights reserved.",Mixed,No,Yes,Maybe,Yes,Mixed/Maybe,Unrated,Maybe,Unrated,Yes,"vulnerability assessment, but nothing on responses.",  not clear whether documenting responses                  ,,
768711,https://apsis.mcc-berlin.net/scoping/document/193/768711/,Beliefs and values explain international differences in perception of solar radiation management: insights from a cross-country survey,"Solar radiation management (SRM) aims to counteract the negative consequences of global warming and is considered for deployment in the event that mitigation and adaptation efforts appear insufficient. However, because the potential ecological and political side effects of SRM are not well understood, and because SRM will cross national boundaries, an international research perspective on the general public's perception of this technology is required. We conducted an online survey on the general public's perception and acceptance of SRM in Canada, China, Germany, Switzerland, the UK, and the USA. Our findings confirmed the need for an international perspective, as we found several cross-country differences. Chinese respondents, for example, indicated greater acceptance for SRM than their North American and European counterparts. Moreover, results of regression analyses on acceptance of SRM by country revealed that lower acceptability ratings for SRM in Canada and Europe were mostly related to stronger beliefs that SRM tampers with nature. Chinese respondents, by contrast, were more accepting of SRM when they held stronger beliefs that it may reduce the motivation to adopt burdensome climate change mitigation efforts. Although our research-and previous studies-suggest that opposition to SRM remains, dismissing the technology entirely on these grounds and without conducting a careful, cross-national, and transdisciplinary decision-support process to set up an international policy regime seems premature as people from countries that are less prepared to mitigate and adapt to climate change seem to be more supportive of SRM.",No,No,No,No,No,Unrated,Unrated,Unrated,Unrated,Unrated, Mitigation focused                   ,,,
771910,https://apsis.mcc-berlin.net/scoping/document/193/771910/,Spatiotemporal change and trend analysis of potential evapotranspiration over the Loess Plateau of China during 2011-2100,"The spatiotemporal change and trend of annual potential evapotranspiration (PET) over the Loess Plateau of China from 2011 to 2100 are assessed in this work. PET is calculated using the Hargreaves model with monthly mean, maximum, and minimum temperatures and a 1 km spatial resolution, which are generated using the Delta downscaling method and general circulation models (GCMs) with four representative concentration pathway (RCP) scenarios. The PET trend is detected via Mann-Kendall and Sen's slope estimator tests. The following results are drawn: (1) the Delta downscaling method shows a favorable performance in detecting GCM monthly temperatures based on the mean absolute error and regression analysis between downscaled data and independent surface observations. Among the 28 GCMs, the NorESM1-M and GISS-E2-R models show the best performance in reproducing the monthly mean/maximum and minimum temperatures over the Loess Plateau, respectively; (2) the average annual PET over this region will increase by 12.7%-23.9% from 1961 to 1990 to the end of this century (2071-2100). However, these increments show strong spatial variations; (3) the annual PET during the 2011-2100 period at each grid of the region demonstrates a significantly increasing trend under each RCP scenario, while RCP2.6, RCP4.5, RCP6.0, and RCP8.5 have average magnitudes of trend of 10.4 mm/10yr, 17.7 mm/10yr, 21 mm/10yr, and 29.7 min/10yr, respectively; (4) the annual PET with significant trends during the other three periods (2011-2040, 2041-2070, and 2071-2100) presentvarious spatial distributions in their magnitudes of trend under the aforementioned RCP scenarios. RCP2.6 showed a significant decrease during 2041-2070 and 2071-2100, although such trends are only observed at 0.3% and 1.2% of the Loess Plateau, respectively; and (5) the spatial results provide some information, such as locations and area ratios, which are valuable in assessing future PET changes and trends. These spatiotemporal results represent the PET changes and trends in detail and provide insights for developing flexible adaptation and mitigation strategies to combat the effects of global warming in this region. (C) 2016 Elsevier B.V. All rights reserved.",No,No,No,No,No,Unrated,Unrated,Unrated,Unrated,Unrated,impacts-focused                    ,,,
775331,https://apsis.mcc-berlin.net/scoping/document/193/775331/,The impacts of key adverse weather events on the field-grown vegetable yield variability in the Czech Republic from 1961 to 2014,"The response of field-grown vegetables to adverse weather conditions is strongly coupled to the timing of adverse events, the sensitivity of the growth stage of the impacted crop and the management actions that are taken. To estimate the long-term yield response to changes in temperature and precipitation as well as the short-term response to key adverse weather events (e.g. heavy precipitation, drought and heat stress) on the yields of vegetable crops, we used several statistical approaches with six daily impact-indicators, the four monthly drought indices and the climate trends. Our study integrated a newly available historical yield dataset at the district level (the finest spatial resolution) for all highly marketable vegetables (celeriac, late carrots, root parsley, early kohlrabi, summer savoy cabbage, late cauliflower, late cabbage, onions, green peas, tomatoes, salad and pickling cucumbers) and a high-resolution historical climate dataset (seven daily meteorological variables at a 10x10km resolution) over a 54-year period in the Czech Republic (CZ). Different indices were used to reflect different dimensions of water and heat stress, which have different impacts on vegetable growth and yield. We find positive long-term impacts of recent warming on fruiting vegetables (from 4.9 to 12.2%degrees C-1) but decreases in the yield stability of traditionally grown root vegetables in the warmest areas of the country. Short-term extreme temperature variabilities (days with heat stress) were found to be the dominant type of adverse event for tomato and cucumber production due to its effect on increased soil water demand, which increased transpiration rates, whereas changes in both the diurnal temperature ranges and minimum temperature (Tmin) were associated with minimal risk of frost damage. Brassicas vegetables are widely irrigated in the CZ, but irrigation does not fully mitigate drought effects; hence, short-term extreme precipitation variability largely controls crop production in the growing districts. The high frequencies of dry days and days with heavy precipitation within the critical growth stages of brassicas reflect a competition between more dry days and greater precipitation intensity on wet days. The yield variability of bulbs is largely explained by both short-term extreme precipitation and temperature variability (drought-heat stress), which reflects the predominantly rain-fed system of onion cultivation. Both drought and heat stress and changes in Tmin were important in explaining yield losses of root vegetables. Legumes had the lowest risk of multiple stresses during their short growth cycle, but droughts remain the dominant type of adverse event. Years with yield gains were substantially more common than years with yield losses for brassicas, bulbs and legumes vegetables in all of the cultivated regions.",No,No,No,No,No,Unrated,Unrated,Unrated,Unrated,Unrated,,,,
787315,https://apsis.mcc-berlin.net/scoping/document/193/787315/,Integrating the social sciences to enhance climate literacy,"The climate literacy movement aspires to help members of the general public understand the global climate system, locate and assess scientifically credible climatic information, communicate about climate change in an educated and objective manner, and make informed and responsible decisions in response to climate-change impacts. When these goals are not met, society will likely be further imperiled by the effects of a changing climate. Climate literacy programs have traditionally promoted education on the biophysical science of the climate system but have largely failed to integrate relevant knowledge from the social sciences. We argue that understanding human behavior and the social drivers of climate change are essential for the public to fully appreciate the climate system, and that this knowledge can inform decision making related to climate-change mitigation and adaptation. Teaching students to evaluate different forms of evidence will also improve climate literacy and lead them to ask how scientists know what they know. Finally, we suggest two new social science principles that could advance interdisciplinary climate literacy goals.",No,No,No,No,No,Unrated,Unrated,Unrated,Unrated,Unrated,Not empirical                    ,,, seems too theoretical                    
799776,https://apsis.mcc-berlin.net/scoping/document/193/799776/,Spatial Optimization of Future Urban Development with Regards to Climate Risk and Sustainability Objectives,"Future development in cities needs to manage increasing populations, climate-related risks, and sustainable development objectives such as reducing greenhouse gas emissions. Planners therefore face a challenge of multidimensional, spatial optimization in order to balance potential tradeoffs and maximize synergies between risks and other objectives. To address this, a spatial optimization framework has been developed. This uses a spatially implemented genetic algorithm to generate a set of Pareto-optimal results that provide planners with the best set of trade-off spatial plans for six risk and sustainability objectives: (i) minimize heat risks, (ii) minimize flooding risks, (iii) minimize transport travel costs to minimize associated emissions, (iv) maximize brownfield development, (v) minimize urban sprawl, and (vi) prevent development of greenspace. The framework is applied to Greater London (U.K.) and shown to generate spatial development strategies that are optimal for specific objectives and differ significantly from the existing development strategies. In addition, the analysis reveals tradeoffs between different risks as well as between risk and sustainability objectives. While increases in heat or flood risk can be avoided, there are no strategies that do not increase at least one of these. Tradeoffs between risk and other sustainability objectives can be more severe, for example, minimizing heat risk is only possible if future development is allowed to sprawl significantly. The results highlight the importance of spatial structure in modulating risks and other sustainability objectives. However, not all planning objectives are suited to quantified optimization and so the results should form part of an evidence base to improve the delivery of risk and sustainability management in future urban development.",Mixed,Maybe,Maybe,Maybe,Yes,Mixed/Maybe,Unrated,Maybe,Unrated,Yes,"Doesn't look empirical, but case application could be. Need to check full text.                     ",,,
899901,https://apsis.mcc-berlin.net/scoping/document/193/899901/,Ecosystems-based adaptation: Are we being conned? Evidence from Mexico,"This paper scrutinises claims made about the promise and efficacy of ecosystems-based adaptation (EBA), through an exploration of EBA-relevant interventions in two fieldsites in Mexico. Our data starts to fill important gaps in current global debates about EBA. We find evidence of the important contribution of interventions relevant to EBA objectives at a small scale and under very specific conditions. However, the viability of similar interventions is substantially reduced, and arguably rendered null, as an incentive for conservation in a more populous fieldsites. Furthermore, evidence suggests that other adaptation options risked being overlooked if the context were viewed solely through the lens of EBA. We conclude that EBA needs to: a) engage with and address the trade-offs which characterised earlier attempts to integrate conservation and development, and; b) acknowledge the implications for its objectives of a globally predominant, neoliberal political economy.",Mixed,Yes,Maybe,Maybe,Maybe,Mixed/Maybe,Yes,Unrated,Unrated,Unrated,,,,not entirely sure what this is about                    
1002779,https://apsis.mcc-berlin.net/scoping/document/193/1002779/,Climate change vulnerability in urban slum communities: Investigating household adaptation and decision-making capacity in the Indian Himalaya,"Climate change is predicted to have severe impacts on mountainous regions, including urban settlements, and livelihoods of the urban poor. Adaptive capacity for marginalized groups is largely determined by household-level resources and decision-making capacity. This study investigated the vulnerability status and prevalent adaptation strategies of urban slum dwellers in Dehradun, Indian Himalayas, using a pre-tested questionnaire covering household characteristics and indicators of vulnerability, in face-to-face interviews with the head of 122 randomly selected households in four slums. We found that overall vulnerability was very high, with very low absorptive and coping capacity for potential impacts of climate change. Moreover, vulnerability and coping strategies were socially differentiated in terms of the decision-making capability and resource capacity of households. Two groups per category (good and bad decision makers; poor and poorer households) were distinguished. The exposure dimension of vulnerability differed significantly by resource capacity and decision capability. However, the sensitivity dimension of vulnerability did not differ between the groups, while the adaptive capacity dimension of vulnerability differed depending on decision-making capability. In designing appropriate strategies for long-term disaster mitigation for urban slums, it is thus important to address slum socio-ecology and the capability and capacity of slum dwellers.",Yes,Yes,Yes,Yes,Yes,Mixed/Maybe,Maybe,Unrated,Unrated,Maybe,"Possibly relevant to D2, but not clear if there is really response beyond adaptive capacity, and if these are directly linked to risk reduction. Would need to look at full text.  ",,,
1060642,https://apsis.mcc-berlin.net/scoping/document/193/1060642/,Proactive energy management of solar greenhouses with risk assessment to enhance smart specialisation in China,"For better time-allocation of stored energy, the solar greenhouse (SGH) is equipped with some storage devices designed economically for local weather: wall storage actively managed with energy-store/retrieve fans and Safety Energy (SE which is a solar collector and fully thermally isolated heat tank) designed for non-regular extreme weather. A proactive energy management process, addressing the optimal energy utilisation through dynamic cooperation of the wall and the SE, is presented in this paper. Based on probabilistic weather forecast and a SGH thermal model, found by system identification, the operation set-points are optimised proactively by minimising the plant probable thermal ""cost"" and weather-related risk in a scheduling period to take pre-emptory action against potential emergencies. The optimisation is formulated in a two-level control scheme. A master problem optimises the primary (wall-soil) storage operation against the expected weather, and a sub-problem operates the SE as a supplement to the limited wall storage in order to create a better indoor environment. The main task of the slave problem manager is to find the optimal SE operation under probable extreme weather to keep reserves to minimise any risk of severe crop loss. The overall optimisation is solved by a hybrid evolutionary algorithm based on a genetic algorithm. The tests show good potential for energy saving and crop cold stress minimisation, as well as great tolerance to forecast errors for most of the cases in Monte-Carlo simulation. The capacity of the proposed real world system to implement the tested risk management scheme over web ""recommendations"" satisfies the need to close the loop of an effective Internet of Things (IoT) system, based on the MACQU (Management And Control for Quality) technological platform. (C) 2017 IAgrE. Published by Elsevier Ltd. All rights reserved.",Mixed,No,Maybe,No,No,Mixed/Maybe,Unrated,No,Unrated,Unrated,Mitigation,,,
1254310,https://apsis.mcc-berlin.net/scoping/document/193/1254310/,Adaptation by the least vulnerable: Managing climate and disaster risks in Finland,"Disaster risk reduction (DRR) and climate change adaptation (CCA) literature has traditionally focused on the countries and regions hit hardest by natural hazards. In this paper, we take a different perspective by turning our eyes upon Finland, a Nordic welfare state and a low vulnerability and exposure society. We analyse and discuss how well the existing DRR and CCA approaches reflect the perspective of the least vulnerable countries and whether the current ways of determining vulnerability and exposure neglect some risks or hinder the seizing opportunities brought by climate change. This paper is based on data gathered in a survey, interviews and workshops in two research projects which analysed weather and climate related risks in Finland. We conclude that disaster risk assessments need to be contingent and account for social and economic contexts. In an institutionally well-functioning welfare society, vulnerability assessments should emphasize relative changes in perceived social trends and social cohesion. Exposure should not be limited to direct geographical or physical exposure to local natural hazards. Successful opportunity identification can help improve DRR at home and abroad. In general, the role of political systems and culture as enabling factors for DRR and CCA need further study.",Yes,Yes,Yes,Yes,Yes,Mixed/Maybe,No,Unrated,No,No,"empirical, but not empirical on responses. focused on vulnerability/risk assessment.",,,
1277265,https://apsis.mcc-berlin.net/scoping/document/193/1277265/,A fuzzy multicriteria categorization of the GALDIT method to assess seawater intrusion vulnerability of coastal aquifers,"Groundwater constitutes the primary source of fresh water for N1.2 billion people living in coastal zones. However, the threat of seawater intrusion iswidespread in coastal aquifers mainly due to overexploitation of groundwater. In the present study, a modified fuzzy multicriteria categorization into non-ordered categories method was developed in order to modify the standard GALDIT method and assess seawater intrusion vulnerability in a coastal aquifer of northern Greece. The method is based on six parameters: groundwater occurrence, aquifer hydraulic conductivity, groundwater level, distance from the shore, impact of the existing status of seawater intrusion, and aquifer thickness. Initially, the originalmethodwas applied and revealed a zone of high vulnerability running parallel to the coastline and covering an area of 8.6 km(2). Themodified GALDIT-Fmethod achieved higher discretization of vulnerability zones which is essential to build a rational management plan to prevent seawater intrusion. The GALDIT-F approach also distinguished an area of the aquifer that is influenced by geothermal fluids. In total, twenty-five categories were produced corresponding to different vulnerability degrees according to the initial method (High, Moderate, Low) as well as the area influenced by geothermal fluids. Finally, a road map was developed in order to adapt management strategies to GALDIT-F categories and prevent and mitigate seawater intrusion. The proposed management strategies of the coastal aquifer include managed aquifer recharge (MAR) implementation, reallocation of existing wells, optimization of pumping rates during the hydrological year, and a detailed monitoring plan. (C) 2017 Elsevier B. V. All rights reserved.",No,No,No,No,No,Unrated,Unrated,Unrated,Unrated,Unrated,"Does refer to a response, but not empirical.",,,
